{
  "id": 7937,
  "title": "EIP-7937: EVM64 - 64-bit mode EVM opcodes",
  "status": "Draft",
  "description": "Multibyte opcodes for 64-bit arithmetic, comparison, bitwise and flow operations in EVM.",
  "author": "Wei Tang (@sorpaas)",
  "type": "Standards Track",
  "category": "Core",
  "createdDate": "2025-04-23",
  "discussionLink": "https://ethereum-magicians.org/t/eip-9687-64-bit-mode-evm-operations/23794",
  "reviewer": "bot",
  "layer": "EL",
  "forkRelationships": [
    {
      "forkName": "Glamsterdam",
      "statusHistory": [],
      "isHeadliner": false,
      "wasHeadlinerCandidate": true,
      "presentationHistory": [
        {
          "type": "headliner_proposal",
          "link": "https://ethereum-magicians.org/t/glamsterdam-headliner-proposal-evm64/24311",
          "date": "2025-05-22"
        },
        {
          "type": "headliner_presentation",
          "call": "acde/213",
          "date": "2025-06-05"
        }
      ]
    }
  ],
  "laymanDescription": "This is the core EIP of the EVM64 collection, introducing 64-bit arithmetic operations to the EVM. The full EVM64 suite includes multiple EIPs enabling much more efficient mathematical computations by adding 64-bit operations alongside existing 256-bit ones.",
  "northStarAlignment": {
    "scaleL1": {
      "description": "Significantly improves computational efficiency for mathematical operations, reducing gas costs and enabling more complex on-chain calculations."
    },
    "improveUX": {
      "description": "Cheaper and faster mathematical operations enable more sophisticated on-chain applications and reduce gas costs for computation-heavy smart contracts."
    }
  },
  "stakeholderImpacts": {
    "endUsers": {
      "description": "Lower gas costs for applications requiring mathematical computations like DeFi protocols, gaming, and scientific applications."
    },
    "appDevs": {
      "description": "Can build much more efficient mathematical applications, implement better algorithms on-chain, and reduce gas costs for computation-intensive smart contracts."
    },
    "walletDevs": {
      "description": "Indirect benefits through lower gas costs for mathematical operations in wallet-related smart contracts."
    },
    "toolingInfra": {
      "description": "Development tools, debuggers, and gas estimation systems need updates to support 64-bit operations and their gas costs."
    },
    "layer2s": {
      "description": "More efficient mathematical operations benefit Layer 2 proof generation and verification systems."
    },
    "stakersNodes": {
      "description": "More efficient computation reduces overall network computational load for mathematical operations."
    },
    "clClients": {
      "description": "No direct impact on consensus layer operations as this affects execution layer computational capabilities."
    },
    "elClients": {
      "description": "Major implementation work required for new 64-bit opcodes, proper gas accounting, and ensuring compatibility with existing 256-bit operations."
    }
  },
  "benefits": [
    "Dramatically reduces gas costs for mathematical operations",
    "Enables more sophisticated on-chain calculations",
    "Improves performance for DeFi and gaming applications",
    "Makes the EVM more competitive with other smart contract platforms"
  ],
  "tradeoffs": null
}
