{
  "id": 7928,
  "title": "EIP-7928: Block-Level Access Lists",
  "status": "Draft",
  "description": "Enforced block access lists with state locations and post-transaction state diffs",
  "author": "Toni Wahrstätter (@nerolation), Dankrad Feist (@dankrad), Francesco D`Amato (@fradamt), Jochem Brouwer (@jochem-brouwer), Ignacio Hagopian (@jsign), Felipe Selmo (@fselmo), Rahul (@raxhvl), Stefan (@qu0b)",
  "type": "Standards Track",
  "category": "Core",
  "createdDate": "2025-03-31",
  "discussionLink": "https://ethereum-magicians.org/t/eip-7928-block-level-access-lists/23337",
  "reviewer": "bot",
  "layer": "EL",
  "forkRelationships": [
    {
      "forkName": "Glamsterdam",
      "statusHistory": [
        {
          "status": "Scheduled",
          "call": null,
          "date": null
        }
      ],
      "isHeadliner": true,
      "wasHeadlinerCandidate": true,
      "champions": [
        {
          "name": "Toni Wahrstätter",
          "discord": "nero_eth"
        }
      ],
      "presentationHistory": [
        {
          "type": "headliner_proposal",
          "link": "https://ethereum-magicians.org/t/eip-7928-block-level-access-lists-the-case-for-glamsterdam/24343",
          "date": "2025-05-26"
        },
        {
          "type": "headliner_presentation",
          "call": "acde/213",
          "date": "2025-06-05"
        }
      ]
    }
  ],
  "laymanDescription": "This introduces access lists at the block level rather than individual transactions, dramatically reducing gas costs for applications that access similar state and enabling new optimization patterns.",
  "northStarAlignment": {
    "scaleL1": {
      "description": "Significantly reduces gas costs for state access through block-level optimization, improving overall network efficiency and throughput."
    },
    "improveUX": {
      "description": "Lower gas costs for complex applications and improved predictability for applications with similar state access patterns."
    }
  },
  "stakeholderImpacts": {
    "endUsers": {
      "description": "Lower gas costs for complex applications, especially DeFi protocols and applications that access similar state across multiple transactions."
    },
    "appDevs": {
      "description": "Can optimize applications for block-level access patterns, significantly reduce gas costs for state-heavy applications, and enable new design patterns."
    },
    "walletDevs": {
      "description": "Indirect benefits through lower gas costs for applications, but minimal direct impact on wallet development."
    },
    "toolingInfra": {
      "description": "Gas estimation tools, transaction simulation, and optimization analysis need updates to handle block-level access list patterns."
    },
    "layer2s": {
      "description": "More efficient state access in Layer 2 settlement transactions and optimized bridge operations."
    },
    "stakersNodes": {
      "description": "More efficient block processing due to optimized state access patterns, reducing computational overhead."
    },
    "clClients": {
      "description": "No direct impact on consensus layer operations as this affects execution layer state access optimization."
    },
    "elClients": {
      "description": "Significant implementation work required for block-level access list management, state access optimization, and gas accounting updates."
    }
  },
  "benefits": [
    "Dramatically reduces gas costs for state-heavy applications",
    "Enables new optimization patterns for developers",
    "Improves block processing efficiency",
    "Provides more predictable gas costs for complex applications"
  ],
  "tradeoffs": null
}
