{
  "id": 7918,
  "title": "EIP-7918: Blob base fee bounded by execution cost",
  "status": "Final",
  "description": "Imposes that the price of GAS_PER_BLOB blob gas is greater than the price of BLOB_BASE_COST execution gas.",
  "author": "Anders Elowsson (@anderselowsson), Ben Adams (@benaadams), Francesco D'Amato (@fradamt)",
  "type": "Standards Track",
  "category": "Core",
  "createdDate": "2025-03-25",
  "discussionLink": "https://ethereum-magicians.org/t/eip-blob-base-fee-bounded-by-price-of-blob-carrying-transaction/23271",
  "reviewer": "bot",
  "forkRelationships": [
    {
      "forkName": "Fusaka",
      "statusHistory": [
        {
          "status": "Scheduled",
          "call": null,
          "date": null
        },
        {
          "status": "Included",
          "call": null,
          "date": null
        }
      ]
    }
  ],
  "laymanDescription": "This addresses blob fee market problems by introducing a reserve price tied to execution costs. When Layer 2 execution costs dominate blob costs, this prevents the blob fee market from becoming ineffective at 1 wei. See a storybook-style explanation [here](https://notes.ethereum.org/@anderselowsson/AIG)!",
  "northStarAlignment": {
    "scaleBlobs": {
      "description": "Critical for L2 economics - ensures sustainable blob pricing that reflects true costs and maintains effective price discovery as L2 usage scales."
    }
  },
  "stakeholderImpacts": {
    "endUsers": {
      "description": "More stable and predictable Layer 2 transaction costs, avoiding dramatic fee spikes when blob market becomes inelastic."
    },
    "appDevs": {
      "description": "More predictable blob cost modeling for applications, especially those with consistent data posting patterns."
    },
    "walletDevs": {
      "description": "More predictable fee estimation for Layer 2 transactions due to improved blob pricing stability."
    },
    "toolingInfra": {
      "description": "Blob fee estimation tools and Layer 2 cost analysis dashboards need updates for the new reserve price mechanism."
    },
    "layer2s": {
      "description": "Fundamental improvement to blob economics - prevents scenarios where blob fees become insignificant relative to execution costs, ensuring healthy fee market dynamics."
    },
    "stakersNodes": {
      "description": "Ensures fair compensation for KZG proof verification compute costs through minimum blob pricing tied to execution base fee."
    },
    "clClients": {
      "description": "Minimal impact as this primarily affects execution layer blob fee calculation mechanisms."
    },
    "elClients": {
      "description": "Need to implement modified calc_excess_blob_gas() function with new reserve price logic and BLOB_BASE_COST parameter."
    }
  },
  "benefits": [
    "Prevents blob fee market collapse",
    "Maintains effective price discovery",
    "Ensures blob consumers pay fair market price for compute",
    "Reduces dramatic fee spikes"
  ],
  "tradeoffs": null,
  "layer": "EL"
}
