{
  "id": 7805,
  "title": "EIP-7805: Fork-choice enforced Inclusion Lists (FOCIL)",
  "status": "Draft",
  "description": "Allow a committee of validators to force-include a set of transactions in every block",
  "author": "Thomas Thiery (@soispoke) <thomas.thiery@ethereum.org>, Francesco D'Amato <francesco.damato@ethereum.org>, Julian Ma <julian.ma@ethereum.org>, Barnabé Monnot <barnabe.monnot@ethereum.org>, Terence Tsao <ttsao@offchainlabs.com>, Jacob Kaufmann <jacob.kaufmann@ethereum.org>, Jihoon Song <jihoon.song@ethereum.org>",
  "type": "Standards Track",
  "category": "Core",
  "createdDate": "2024-11-01",
  "discussionLink": "https://ethereum-magicians.org/t/eip-7805-committee-based-fork-choice-enforced-inclusion-lists-focil/21578",
  "reviewer": "bot",
  "layer": "CL",
  "forkRelationships": [
    {
      "forkName": "Glamsterdam",
      "statusHistory": [
        {
          "status": "Considered",
          "call": null,
          "date": null
        },
        {
          "status": "Declined",
          "call": "acdc/171",
          "date": "2025-12-11"
        }
      ],
      "isHeadliner": false,
      "wasHeadlinerCandidate": true,
      "champions": [
        {
          "name": "soispoke",
          "discord": "soispoke"
        }
      ],
      "presentationHistory": [
        {
          "type": "headliner_proposal",
          "link": "https://ethereum-magicians.org/t/eip-7805-fork-choice-inclusion-lists-focil-as-a-candidate-for-glamsterdam/24342",
          "date": "2025-05-26"
        },
        {
          "type": "headliner_presentation",
          "call": "acdc/158",
          "date": "2025-05-29"
        }
      ]
    },
    {
      "forkName": "Hegota",
      "statusHistory": [
        {
          "status": "Considered",
          "call": "acdc/171",
          "date": "2025-12-11"
        },
        {
          "status": "Scheduled",
          "call": "acdc/175",
          "date": "2026-02-19"
        }
      ],
      "isHeadliner": true,
      "wasHeadlinerCandidate": true,
      "champions": [
        {
          "name": "soispoke",
          "discord": "soispoke"
        }
      ],
      "presentationHistory": [
        {
          "type": "headliner_proposal",
          "link": "https://ethereum-magicians.org/t/hegota-headliner-proposal-focil-eip-7805/27604",
          "date": "2026-01-27"
        },
        {
          "type": "headliner_presentation",
          "call": "acdc/174",
          "date": "2026-02-05"
        }
      ]
    }
  ],
  "laymanDescription": "FOCIL empowers multiple validators to mandate the inclusion of specific transactions in each block, thereby improving the network's censorship resistance properties.",
  "northStarAlignment": {
    "scaleL1": {
      "description": "Ethereum currently relies on local block builders to preserve censorship resistance. However, depending on local block builders comes at a cost to performance and incentives, which may conflict with scaling throughput. FOCIL is crucial in L1 scaling because it helps decouple local block building from censorship resistance."
    },
    "scaleBlobs": {
      "description": "A more censorship-resistant L1 provides better foundation for Layer 2 settlement guarantees, and allows to shorten the exit time window for optimistic rollups."
    },
    "improveUX": {
      "description": "Provides strong guarantees against transaction censorship and ensures fair access to block space for all users regardless of transaction content."
    }
  },
  "stakeholderImpacts": {
    "endUsers": {
      "description": "Strong protection against transaction censorship for all end users, guaranteed inclusion for valid transactions, and improved confidence in Ethereum's credible neutrality."
    },
    "appDevs": {
      "description": "Can build applications with stronger inclusion guarantees and reduced concerns about application-specific censorship."
    },
    "walletDevs": {
      "description": "Can provide users with stronger transaction inclusion guarantees and better protection against selective censorship."
    },
    "toolingInfra": {
      "description": "Censorship monitoring tools, inclusion list analysis, and validator behavior tracking systems need major updates after FOCIL implementation."
    },
    "layer2s": {
      "description": "More censorship-resistant L1 settlement provides stronger guarantees for Layer 2 transaction processing, bridge operations, and reduces rollup challenge period risks."
    },
    "stakersNodes": {
      "description": "Validators must now build inclusion lists according to the protocol rules, and attesters must enforce inclusion lists conditions are satisfied before voting for a block."
    },
    "clClients": {
      "description": "Major implementation work required for inclusion lists propagation and enforcement, including fork-choice modifications."
    },
    "elClients": {
      "description": "Need build inclusion lists, to update the execution payload with inclusion list transactions, and communicate with the consensus layer."
    }
  },
  "benefits": [
    "Provides strong censorship resistance guarantees",
    "Ensures fair access to block space for all users",
    "Strengthens Ethereum's credible neutrality"
  ],
  "tradeoffs": null
}
