{
  "id": 7979,
  "title": "EIP-7979: Call and Return Opcodes for the EVM",
  "status": "Draft",
  "description": "Three new instructions to support calls and returns, with optional validated control flow.",
  "author": "Greg Colvin <greg@colvin.org>, Martin Holst Swende (@holiman), Brooklyn Zelenka (@expede), John Max Skaller <skaller@internode.on.net>",
  "type": "Standards Track",
  "category": "Core",
  "createdDate": "2025-12-17",
  "discussionLink": "https://ethereum-magicians.org/t/eip-7979-call-and-return-opcodes-for-the-evm/24615",
  "reviewer": "expert",
  "layer": "EL",
  "forkRelationships": [
    {
      "forkName": "Glamsterdam",
      "statusHistory": [
        {
          "status": "Proposed",
          "call": null,
          "date": null
        },
        {
          "status": "Declined",
          "call": "acde/225",
          "date": "2025-12-04"
        }
      ],
      "champions": [
        {
          "name": "Greg Colvin",
          "email": "greg@colvin.org"
        }
      ]
    }
  ],
  "laymanDescription": "Introduces instructions to call and return from subroutines, which are missing from the EVM.  This lets compilers generate code with static control flow, which allows for more performant clients and quadradictally more efficient static analysis tools",
  "stakeholderImpacts": {
    "endUsers": {
      "description": "Increased security and more performant smart contract execution."
    },
    "appDevs": {
      "description": "Better tools.  Especially, better static analysis and formal verification."
    },
    "walletDevs": {
      "description": "No direct impact"
    },
    "toolingInfra": {
      "description": "Compilers must produce static, validated EVM code."
    },
    "layer2s": {
      "description": "Some Layer 2 and EVM-compatible chains could benefit from more performant client."
    },
    "stakersNodes": {
      "description": "No direct impact, but enables more clients to implement performance gains"
    },
    "clClients": {
      "description": "No changes required for consensus layer implementations."
    },
    "elClients": {
      "description": "Implementation of the instructions and validation is straightforward, and clients can better optimize their execution of validated code."
    }
  },
  "benefits": [
    "Makes static EVM control flow possible, which static analysis people have been requesting for many years.",
    "Static control flow can make static analysis and formal verification of EVM code quadratically more efficient.",
    "Static control flow makes linear-time translators of EVM code possible, including one-pass compilers to machine code and RISC-V.",
    "Clients can validate that deployed code cannot execute invalid instructions, jump to invalid locations, or misuse the stack.",
    "Maintains backwards compatibility, enabling a smooth transition.  Tools and developers can take up the new features as they become available."
  ],
  "tradeoffs": null
}
