{
  "id": 7886,
  "title": "EIP-7886: Delayed execution",
  "status": "Stagnant",
  "description": "Separate block validation from execution",
  "author": "Francesco D'Amato (@fradamt), Toni Wahrstätter (@nerolation)",
  "type": "Standards Track",
  "category": "Core",
  "createdDate": "2025-02-18",
  "discussionLink": "https://ethereum-magicians.org/t/eip-7886-delayed-execution/22890",
  "reviewer": "bot",
  "layer": "EL",
  "forkRelationships": [
    {
      "forkName": "Glamsterdam",
      "statusHistory": [
        {
          "status": "Declined",
          "call": "acde/218",
          "date": "2025-08-14"
        }
      ],
      "isHeadliner": false,
      "wasHeadlinerCandidate": true,
      "presentationHistory": [
        {
          "type": "headliner_proposal",
          "link": "https://ethereum-magicians.org/t/eip-7886-delayed-execution-the-case-for-glamsterdam/24500",
          "date": "2025-06-09"
        }
      ]
    }
  ],
  "laymanDescription": "Lets validators attest before execution by deferring execution outputs, improving throughput headroom.",
  "northStarAlignment": {
    "scaleL1": {
      "description": "Reduces validation latency and can enable higher block gas limits, contributing to L1 throughput."
    }
  },
  "stakeholderImpacts": {
    "endUsers": {
      "description": "Largely transparent; faster attestations possible, but no guaranteed MEV/fairness changes. Same-block funding patterns may fail due to pre-checks."
    },
    "appDevs": {
      "description": "Must handle deferred receipts/logs in the child header and possible payload reversion; core application semantics and APIs remain unchanged."
    },
    "walletDevs": {
      "description": "Adapt UX for attestation-before-execution, surfacing pending states; enforce nonce/balance prechecks and warn about same-block funding limitations."
    },
    "toolingInfra": {
      "description": "Indexers, explorers, and RPCs must track deferred execution outputs, the execution_reverted flag, and updated base-fee behavior for reverted parents."
    },
    "layer2s": {
      "description": "Bridges and settlement relying on L1 receipts should accommodate one-block deferral and detect reverted-parent semantics; data availability rules remain unchanged."
    },
    "stakersNodes": {
      "description": "Validators/proposers attest earlier after static checks; need new header validation, deferred-output tracking, and off-critical-path execution scheduling."
    },
    "clClients": {
      "description": "Must process new header fields and parent flags, manage EL request deferrals, and integrate with EL without changing fork-choice rules."
    },
    "elClients": {
      "description": "Significant work: split static validation from execution, implement sender pre-charging, snapshots/reversion, new chain-state tracking, and base-fee handling for reverts."
    }
  },
  "benefits": [
    "Asynchronous attestation before execution reduces the critical path, enabling higher gas limits and overall network throughput.",
    "Minimal checks using previous state and parent outputs let validators deem blocks valid without executing transactions.",
    "Senders are pre-charged maximum fees and balances/nonces verified, significantly reducing execution-time failures and fragile same-block dependencies.",
    "Snapshot-and-revert preserves liveness: mismatched gas used resets receipts, logs, and execution outputs without discarding blocks from the chain.",
    "Base-fee dynamics remain fair: reverted parents count as zero gas used, preventing fee-market manipulation via overdeclared usage."
  ],
  "tradeoffs": null
}
