{
  "id": 7549,
  "title": "EIP-7549: Move committee index outside Attestation",
  "status": "Final",
  "description": "Move committee index outside of the signed Attestation message",
  "author": "dapplion (@dapplion), Mikhail Kalinin (@mkalinin)",
  "type": "Standards Track",
  "category": "Core",
  "createdDate": "2023-11-01",
  "discussionLink": "https://ethereum-magicians.org/t/eip-7549-move-committee-index-outside-attestation/16390",
  "reviewer": "bot",
  "forkRelationships": [
    {
      "forkName": "Pectra",
      "statusHistory": [
        {
          "status": "Included",
          "call": null,
          "date": null
        }
      ]
    }
  ],
  "laymanDescription": "Simplifies the structure of validator attestations by moving the committee index field outside the signed message, making verification and aggregation cheaper.",
  "northStarAlignment": {
    "scaleL1": {
      "description": "Reduces consensus layer overhead for attestation validation and aggregation, improving performance and paving the way for higher throughput."
    }
  },
  "stakeholderImpacts": {
    "endUsers": {
      "description": "No direct impact"
    },
    "appDevs": {
      "description": "No changes to applications."
    },
    "walletDevs": {
      "description": "Wallets unchanged."
    },
    "toolingInfra": {
      "description": "Consensus monitoring tools have to update parsing of attestations."
    },
    "layer2s": {
      "description": "No direct change on L2s unless they rely on attestation data."
    },
    "stakersNodes": {
      "description": "Lower resource usage for attestation handling and aggregation, less data to process."
    },
    "clClients": {
      "description": "Implementation changes to attestation structures and verification."
    },
    "elClients": {
      "description": "Execution layer not affected."
    }
  },
  "benefits": [
    "More efficient consensus verification and aggregation",
    "Improves performance for consensus nodes processing lot of signatures"
  ],
  "tradeoffs": null,
  "layer": "CL"
}
